898743793, ENTRENAMIENTO MICHAE, AUG 25 2008 11:35PM, HSINCHU, 15491731
899219102, MISE A JOUR DES PREC, AUG 26 2008  7:43PM, HSINCHU, 14163678
899556611, I AM SO VERY TIRED, AUG 26 2008  5:32PM, HSINCHU, 8055532
899820877, LOOKS LIKE THE PEACE, AUG 26 2008 10:21PM, HSINCHU, 8055532
900520053, JE TRAVAILLE A LECR, AUG 27 2008 10:19PM, HSINCHU, 14163678
901448409, MELBOURNE RUBY USER, AUG 28 2008  8:32AM, HSINCHU, 9366872
902846015, JE VIENS DAVOIR UN, AUG 29 2008  9:01PM, HSINCHU, 14163678
904451130, , AUG 31 2008  1:41AM, HSINCHU, 16060889
904453280, , AUG 31 2008  1:45AM, HSINCHU, 16060889
904453542, , AUG 31 2008  1:45AM, HSINCHU, 16060889
904597131, , AUG 31 2008  5:46AM, HSINCHU, 16060889
904653336, , AUG 31 2008  7:58AM, HSINCHU, 16060889
904688489, , AUG 31 2008  9:26AM, HSINCHU, 16060889
905336405, , SEP  1 2008  2:50AM, HSINCHU, 16060889
905418160, , SEP  1 2008  4:49AM, HSINCHU, 16060889
905437220, , SEP  1 2008  5:20AM, HSINCHU, 16060889
905713255, X RENTREE SCOLAIRE, SEP  1 2008  9:21PM, HSINCHU, 14163678
905750092, I BETTER GET BACK TO, SEP  1 2008  2:06PM, HSINCHU, 8055532
905853091, DS, SEP  1 2008  3:59PM, HSINCHU, 16060889
906347798, ROGER, SEP  2 2008  2:17AM, HSINCHU, 16060889
906499003, , SEP  2 2008  5:53AM, HSINCHU, 16060889
906666646, , SEP  2 2008 11:03AM, HSINCHU, 16060889
906712120, GENIAL ROBINHO ESE, SEP  2 2008 12:10PM, HSINCHU, 15491731
906712917, Y DIGO MAS POR FIN, SEP  2 2008 12:11PM, HSINCHU, 15491731
908704995, EVERYONE SHOULD CHEC, SEP  3 2008 11:48PM, HSINCHU, 8055532
909266940, , SEP  4 2008 11:13AM, HSINCHU, 16060889
910120202, , SEP  5 2008  1:16AM, HSINCHU, 16060889
910174904, , SEP  5 2008  2:09AM, HSINCHU, 16060889
910276322, RY, SEP  5 2008  3:22AM, HSINCHU, 16060889
910345991, GOT TO LEAVE WORK EA, SEP  5 2008  4:43AM, HSINCHU, 9366872
910355297, , SEP  5 2008  4:56AM, HSINCHU, 16060889
910392105, , SEP  5 2008  5:53AM, HSINCHU, 16060889
910427860, HTTPBITLYKKK, SEP  5 2008  6:56AM, HSINCHU, 9366872
910559589, , SEP  5 2008 10:48AM, HSINCHU, 16060889
910613717, LOOKING FOR A DESIGN, SEP  5 2008 12:06PM, HSINCHU, 9366872
911464980, , SEP  6 2008  2:37AM, HSINCHU, 16060889
911671271, DEATH, SEP  6 2008  8:29AM, HSINCHU, 16060889
911811400, NOTRE FAMILLE A VECU, SEP  6 2008  9:25PM, HSINCHU, 14163678
913219916, QUE TRISTE ES LO BAJ, SEP  7 2008 11:41PM, HSINCHU, 15491731
913687892, , SEP  8 2008 10:53AM, HSINCHU, 16060889
914574490, , SEP  9 2008  2:04AM, HSINCHU, 16060889
914709526, , SEP  9 2008  4:45AM, HSINCHU, 16060889
914726420, MK, SEP  9 2008  5:10AM, HSINCHU, 16060889
914897924, , SEP  9 2008 10:12AM, HSINCHU, 16060889
916528754, IT SEEMS TO ME THAT, SEP 10 2008  3:39PM, HSINCHU, 8055532
919717465, , SEP 13 2008  2:54AM, HSINCHU, 16060889
919895778, , SEP 13 2008  7:40AM, HSINCHU, 16060889
919895863, , SEP 13 2008  7:40AM, HSINCHU, 16060889
920659739, , SEP 14 2008  2:15AM, HSINCHU, 16060889
921194173, ITS A BACKTOSCHO, SEP 14 2008  5:33PM, HSINCHU, 8055532
921227995, JUST ATE NOW CHILLI, SEP 15 2008  2:12AM, HSINCHU, 16285429
921259039, FINALLY GOT THE SMS, SEP 15 2008  2:47AM, HSINCHU, 16285429
921300475, WATCHING JERRY MCGUI, SEP 15 2008  3:39AM, HSINCHU, 16285429
921393851, SCHOOL IS TOMORROW, SEP 15 2008  5:40AM, HSINCHU, 16285429
921638659, OMFGZ IM BORED, SEP 15 2008 10:56AM, HSINCHU, 16285429
922608124, SCHOOL WAS FUUUN GE, SEP 16 2008  5:56AM, HSINCHU, 16285429
922996663, , SEP 16 2008  5:19AM, HSINCHU, 16060889
922996733, , SEP 16 2008  5:19AM, HSINCHU, 16060889
922996858, , SEP 16 2008  5:19AM, HSINCHU, 16060889
923864726, IM ON MYSPACE I NEE, SEP 17 2008  5:45AM, HSINCHU, 16285429
923987040, ITS SUPA PRETTY OUTS, SEP 17 2008  7:56AM, HSINCHU, 16285429
925140406, WITH SOME FRIENDS C, SEP 18 2008  5:19AM, HSINCHU, 16285429
925255233, I GOTS A NEW CAMERAA, SEP 18 2008  7:22AM, HSINCHU, 16285429
926690378, , SEP 19 2008  1:56AM, HSINCHU, 16060889
928014962, , SEP 20 2008  2:23AM, HSINCHU, 16060889
928138311, BACKUP UP STUFF ON M, SEP 20 2008  5:24AM, HSINCHU, 9366872
928173368, HTTPTWITPICCOMC, SEP 20 2008  6:36AM, HSINCHU, 9366872
930068791, , SEP 22 2008  5:15AM, HSINCHU, 16060889
930093096, W, SEP 22 2008  5:57AM, HSINCHU, 16060889
931047478, HAVE A REALLY BAD HE, SEP 23 2008  8:13AM, HSINCHU, 16285429
933822221, , SEP 25 2008  2:06AM, HSINCHU, 16060889
938306994, IS WORKING HER WAY T, SEP 28 2008  6:05PM, HSINCHU, 16500570
938672406, , SEP 29 2008  1:38AM, HSINCHU, 16060889
938874674, WISH, SEP 29 2008  5:58AM, HSINCHU, 16060889
938928219, HTTPTWITPICCOMD, SEP 29 2008  7:32AM, HSINCHU, 9366872
939071373, XHTML, SEP 29 2008 11:34AM, HSINCHU, 16060889
939496032, EL DISCO DE LA SEMAN, SEP 29 2008  5:53PM, HSINCHU, 8229592
939534287, SUCESION LOGICA DEL, SEP 29 2008  6:23PM, HSINCHU, 8229592
939650854, JET MAN CRUZA EL CAN, SEP 29 2008  7:53PM, HSINCHU, 8229592
939759546, COMO HACER UN SIDEBA, SEP 29 2008  9:23PM, HSINCHU, 8229592
939759579, EL MICROMUNDO DE NIK, SEP 29 2008  9:23PM, HSINCHU, 8229592
939879899, TOP  LIDERES DE IN, SEP 29 2008 11:22PM, HSINCHU, 8229592
940346796, ANADIR MYSFERA A FEE, SEP 30 2008  9:23AM, HSINCHU, 8229592
940381110, BLANCANIEVES DIVORCI, SEP 30 2008 10:22AM, HSINCHU, 8229592
940399755, CANCELADO EL SEMINAR, SEP 30 2008 10:52AM, HSINCHU, 8229592
940412493, PHOTO OF YARRA  MCG, SEP 30 2008 11:11AM, HSINCHU, 9366872
940496052, RECLAMO DE OPORTUNID, SEP 30 2008 12:52PM, HSINCHU, 8229592
940600293, IS EXCITED ABOUT FIN, SEP 30 2008  2:23PM, HSINCHU, 16500570
940601973, MODO JUICIO OFF LA, SEP 30 2008  2:24PM, HSINCHU, 8229592
940638164, ENTREVISTA EN INTERN, SEP 30 2008  2:53PM, HSINCHU, 8229592
940789881, EDITORIAL EN MYSFERA, SEP 30 2008  4:53PM, HSINCHU, 8229592
940927464, ELIAS NOTARIO EN OND, SEP 30 2008  6:53PM, HSINCHU, 8229592
940992742, KUBRICK EN SITGES A, SEP 30 2008  7:53PM, HSINCHU, 8229592
940992765, ADIOS A LOS MEJORES, SEP 30 2008  7:53PM, HSINCHU, 8229592
940992787, HOMENAJE A JOHN CARP, SEP 30 2008  7:53PM, HSINCHU, 8229592
941118339, THIS LOOKS GOOD NEW, SEP 30 2008  9:47PM, HSINCHU, 9366872
941409819, WOAH THAT NEW WEBKIT, OCT  1 2008  2:54AM, HSINCHU, 9366872
941612646, BUSCAR EN GOOGLE COM, OCT  1 2008  7:22AM, HSINCHU, 8229592
941630593, ESTADISTICAS DE SEPT, OCT  1 2008  7:53AM, HSINCHU, 8229592
941630602, WEB SEARCH STRATEGIE, OCT  1 2008  7:53AM, HSINCHU, 8229592
941779974, WONDER HOW TO EL PA, OCT  1 2008 11:52AM, HSINCHU, 8229592
941779999, EL GOOGLE DEL TIEMPO, OCT  1 2008 11:52AM, HSINCHU, 8229592
941865538, LOS ROSTROS DE LOS N, OCT  1 2008  1:22PM, HSINCHU, 8229592
941938115, LA NASA CUMPLE  AN, OCT  1 2008  2:23PM, HSINCHU, 8229592
941977082, RGB LIQUIDO MANGAS, OCT  1 2008  2:52PM, HSINCHU, 8229592
942212438, PROTAGONISTAS DE LA, OCT  1 2008  5:53PM, HSINCHU, 8229592
942280789, EL IDILIO FUTBOL DE, OCT  1 2008  6:52PM, HSINCHU, 8229592
942349815, LA RELAJACION FUTBO, OCT  1 2008  7:52PM, HSINCHU, 8229592
942483728, VUELVE BLOGOFF EL B, OCT  1 2008  9:51PM, HSINCHU, 8229592
942688405, NOVEDADES EN GOOGLE, OCT  2 2008  1:22AM, HSINCHU, 8229592
942717706, LAS REDES SOCIALES, OCT  2 2008  1:52AM, HSINCHU, 8229592
942748536, NOS TOCA PAGAR MANG, OCT  2 2008  2:22AM, HSINCHU, 8229592
943019016, CAMBIOS EN GOOGLE BL, OCT  2 2008  8:22AM, HSINCHU, 8229592
943019029, EL REGRESO DE BLOGOF, OCT  2 2008  8:22AM, HSINCHU, 8229592
943054444, LA TAZA DE CRISTO E, OCT  2 2008  9:23AM, HSINCHU, 8229592
943071201, GEORGE W BIENVENID, OCT  2 2008  9:50AM, HSINCHU, 8229592
943072329, GEORGE W BIENVENID, OCT  2 2008  9:52AM, HSINCHU, 8229592
943077863, HATES THE INTERNET, OCT  2 2008 10:01AM, HSINCHU, 16500570
943129101, TOG ANADE FUNCIONES, OCT  2 2008 11:22AM, HSINCHU, 8229592
943178151, CONFERENCIA DEL FUND, OCT  2 2008 12:22PM, HSINCHU, 8229592
943272924, INTERNET ES PARA PO, OCT  2 2008  1:52PM, HSINCHU, 8229592
943310921, BLINDNESS EL LIBRO, OCT  2 2008  2:22PM, HSINCHU, 8229592
943351239, PROVOCAN CANCER LOS, OCT  2 2008  2:53PM, HSINCHU, 8229592
943431862, EL DON DE LA IMBATIB, OCT  2 2008  3:53PM, HSINCHU, 8229592
943472987, UN SALVADOR FUTBOL, OCT  2 2008  4:23PM, HSINCHU, 8229592
943473012, FUTBOL DE LUX, OCT  2 2008  4:23PM, HSINCHU, 8229592
943904334, ACH GUANAC CUMPLE, OCT  2 2008 10:22PM, HSINCHU, 8229592
943996972, OTRAS VISIONES DE LA, OCT  2 2008 11:52PM, HSINCHU, 8229592
944028555, DOS MANIFIESTOS EL, OCT  3 2008 12:23AM, HSINCHU, 8229592
944061630, YA PUEDES CHATEAR CO, OCT  3 2008 12:52AM, HSINCHU, 8229592
944404368, EL DOBLADOR DE CUCHA, OCT  3 2008  2:52AM, HSINCHU, 8229592
944582829, , OCT  3 2008  5:58AM, HSINCHU, 16060889
944687616, GRADOSCOM YA TIE, OCT  3 2008  8:52AM, HSINCHU, 8229592
944758452, EL LADO OSCURO HACE, OCT  3 2008 10:53AM, HSINCHU, 8229592
944777407, LICENCIA MCCAINPALI, OCT  3 2008 11:22AM, HSINCHU, 8229592
944831544, AAAAA, OCT  3 2008 12:31PM, HSINCHU, 16060889
945073832, PREMIO A LOS DESCUBR, OCT  3 2008  3:52PM, HSINCHU, 8229592
945266313, ACTORES QUE NO VI, OCT  3 2008  6:23PM, HSINCHU, 8229592
945301045, DUKE NUKEM D EN ALT, OCT  3 2008  6:53PM, HSINCHU, 8229592
945333813, TUENTI EN EL MUNDO, OCT  3 2008  7:23PM, HSINCHU, 8229592
945399904, PROTAGONISTAS DE LA, OCT  3 2008  8:22PM, HSINCHU, 8229592
945493001, PLENOS FUTBOL DE LU, OCT  3 2008  9:52PM, HSINCHU, 8229592
945493035, GRUPO DE GOOGLE GROU, OCT  3 2008  9:52PM, HSINCHU, 8229592
945493060, ANOS DESPUES A C, OCT  3 2008  9:53PM, HSINCHU, 8229592
945549279, TWITTFRIEND LOS AMI, OCT  3 2008 10:52PM, HSINCHU, 8229592
945576085, TIPOS DE LETRA CO, OCT  3 2008 11:22PM, HSINCHU, 8229592
945726490, , OCT  4 2008  2:19AM, HSINCHU, 16060889
945875774, , OCT  4 2008  5:41AM, HSINCHU, 16060889
945882096, ESPACIO USQUIANO BL, OCT  4 2008  5:52AM, HSINCHU, 8229592
945892498, W, OCT  4 2008  6:09AM, HSINCHU, 16060889
945913718, ESPACIO USQUIANO E, OCT  4 2008  6:49AM, HSINCHU, 8229592
945970180, BLOGS Y PODER EN LA, OCT  4 2008  8:52AM, HSINCHU, 8229592
945993212, , OCT  4 2008  9:45AM, HSINCHU, 16060889
945993372, , OCT  4 2008  9:46AM, HSINCHU, 16060889
946053006, , OCT  4 2008 11:55AM, HSINCHU, 16060889
946067912, INTERNET VS VIDA REA, OCT  4 2008 12:22PM, HSINCHU, 8229592
946105400, EL RELOJ DE TU VIDA, OCT  4 2008  1:22PM, HSINCHU, 8229592
946105409, YA ESTAMOS CON EL P, OCT  4 2008  1:22PM, HSINCHU, 8229592
946151327, ISTELLAR UN PLANETA, OCT  4 2008  2:22PM, HSINCHU, 8229592
946251346, WOW A TEMPLE IN ROM, OCT  4 2008  4:16PM, HSINCHU, 8055532
946256922, COMO HACEN DINERO LO, OCT  4 2008  4:22PM, HSINCHU, 8229592
946284298, LA MUSA DEL PARKED, OCT  4 2008  4:52PM, HSINCHU, 8229592
946336962, LA GRAN NOCHE FUTBO, OCT  4 2008  5:52PM, HSINCHU, 8229592
946336973, NO VIERON SU PELICUL, OCT  4 2008  5:52PM, HSINCHU, 8229592
946591545, POR CIERTO NO ESTA N, OCT  4 2008 11:19PM, HSINCHU, 15491731
946707897, NIGHT EVERYONE, OCT  5 2008  1:52AM, HSINCHU, 16597579
947006791, VILLARREAL SIGUE CON, OCT  5 2008 10:22AM, HSINCHU, 8229592
947006804, CHISMORREOS A RAYAS, OCT  5 2008 10:22AM, HSINCHU, 8229592
947006814, DORMIR FUTBOL DE LU, OCT  5 2008 10:22AM, HSINCHU, 8229592
947302439, TEQUILA EN LA SALA R, OCT  5 2008  5:22PM, HSINCHU, 8229592
947377633, LA SECUELA DE BLADE, OCT  5 2008  6:52PM, HSINCHU, 8229592
947598236, YA SOMOS MAS DE  E, OCT  5 2008 11:22PM, HSINCHU, 8229592
947693360, , OCT  6 2008  1:15AM, HSINCHU, 16060889
947766845, W, OCT  6 2008  2:38AM, HSINCHU, 16060889
947965274, EL MBA DE STANFORD E, OCT  6 2008  7:22AM, HSINCHU, 8229592
947965280, NOKIA  XPRESSMUS, OCT  6 2008  7:22AM, HSINCHU, 8229592
948034465, SITIOS ADONDE HACER, OCT  6 2008  9:22AM, HSINCHU, 8229592
948070948, BLOG CLIPPINGS ECUA, OCT  6 2008 10:22AM, HSINCHU, 8229592
948089778, ULTIMAS LISTAS DE TH, OCT  6 2008 10:52AM, HSINCHU, 8229592
948109758, WORDPRESS AL DIA LI, OCT  6 2008 11:22AM, HSINCHU, 8229592
948132027, MAL OLOR LA NUEVA A, OCT  6 2008 11:52AM, HSINCHU, 8229592
948132048, XDRTB  FOTOS, OCT  6 2008 11:52AM, HSINCHU, 8229592
948215227, ME DEBE  EUROS MA, OCT  6 2008  1:22PM, HSINCHU, 8229592
948215247, EL PAGERANK BLOGPOC, OCT  6 2008  1:22PM, HSINCHU, 8229592
948215265, LA PANTALLA LED MAS, OCT  6 2008  1:22PM, HSINCHU, 8229592
948250276, PARA QUE SIRVE EL P, OCT  6 2008  1:53PM, HSINCHU, 8229592
948367471, MICHAEL MOORE Y EL R, OCT  6 2008  3:22PM, HSINCHU, 8229592
948367498, GOS  GADGETS EL LI, OCT  6 2008  3:22PM, HSINCHU, 8229592
948408496, ENTREVISTA EN HABITO, OCT  6 2008  3:54PM, HSINCHU, 8229592
948446015, BRICOLAJE EXTREMO M, OCT  6 2008  4:23PM, HSINCHU, 8229592
948446036, OTRO APOCALIPSIS PAR, OCT  6 2008  4:23PM, HSINCHU, 8229592
948520456, RICHARD STALLMAN CON, OCT  6 2008  5:23PM, HSINCHU, 8229592
948539361, IS WITHOUT A PHONE A, OCT  6 2008  5:40PM, HSINCHU, 16500570
948625957, EL DISCO DE LA SEMAN, OCT  6 2008  6:53PM, HSINCHU, 8229592
948732974, IBRAHIMOVIC LA CALI, OCT  6 2008  8:23PM, HSINCHU, 8229592
948733058, LOS PUNTOS FUTBOL D, OCT  6 2008  8:23PM, HSINCHU, 8229592
948733079, TRES EN EL CANDIN F, OCT  6 2008  8:23PM, HSINCHU, 8229592
948925615, ENTREVISTA EN OJOCRI, OCT  6 2008 11:23PM, HSINCHU, 8229592
949038825, GOOD MOURNING, OCT  7 2008  1:17AM, HSINCHU, 16060889
949214917, , OCT  7 2008  4:10AM, HSINCHU, 16060889
949223905, NY, OCT  7 2008  4:21AM, HSINCHU, 16060889
949330910, DIPLODOCS CUALQUIER, OCT  7 2008  7:23AM, HSINCHU, 8229592
949368952, , OCT  7 2008  8:26AM, HSINCHU, 16060889
949385179, GMAIL SE ASEGURA DE, OCT  7 2008  8:52AM, HSINCHU, 8229592
949403844, EDIFICIOS FASCINA, OCT  7 2008  9:22AM, HSINCHU, 8229592
949416513, TODO VA RESTAURANDOS, OCT  7 2008  9:43AM, HSINCHU, 15491731
949422682, ESTANDARES DE LA INT, OCT  7 2008  9:53AM, HSINCHU, 8229592
949423274, Y LA BASURA AL BIDO, OCT  7 2008  9:54AM, HSINCHU, 15491731
949461989, ISLANDIA EN BANCARR, OCT  7 2008 10:52AM, HSINCHU, 8229592
949483413, MANUEL ALMEIDA ENTRE, OCT  7 2008 11:22AM, HSINCHU, 8229592
949483429, PARA QUE USAR TWITTE, OCT  7 2008 11:22AM, HSINCHU, 8229592
949597686, IDPHOTOSTUDIO IMPRI, OCT  7 2008  1:23PM, HSINCHU, 8229592
949672937, ANOS DE LA NASA E, OCT  7 2008  2:22PM, HSINCHU, 8229592
949714309, VIDEO PARA ENTENDER, OCT  7 2008  2:53PM, HSINCHU, 8229592
949756457, ATRACTIVOS EFECTO, OCT  7 2008  3:23PM, HSINCHU, 8229592
950101102, RECURSOS PARA TWI, OCT  7 2008  7:53PM, HSINCHU, 8229592
950898901, MAS DE  SITIOS PAR, OCT  8 2008  5:22AM, HSINCHU, 8229592
950980665, EL BLOG DE LA SEMANA, OCT  8 2008  7:23AM, HSINCHU, 8229592
951018074, IV CONGRESO PANAMERI, OCT  8 2008  8:22AM, HSINCHU, 8229592
951055639, JESSICA ALBA NOS TRA, OCT  8 2008  9:23AM, HSINCHU, 8229592
951112842, CONCURSO DE IDEAS PA, OCT  8 2008 10:53AM, HSINCHU, 8229592
951133986, PROTAGONISTAS DE LA, OCT  8 2008 11:22AM, HSINCHU, 8229592
951247344, MAS DE  HACKS PARA, OCT  8 2008  1:24PM, HSINCHU, 8229592
951404053, MAGNIFICOS EFECTO, OCT  8 2008  3:23PM, HSINCHU, 8229592
951487409, SEGUNDA OLEADA DE CL, OCT  8 2008  4:22PM, HSINCHU, 8229592
951565946, BREVE RESUMEN DE NOT, OCT  8 2008  5:22PM, HSINCHU, 8229592
951565987, XVIII BLOGS  GOFIO, OCT  8 2008  5:22PM, HSINCHU, 8229592
951566002, EL GABINETE DE INFOR, OCT  8 2008  5:22PM, HSINCHU, 8229592
951566026, OXCARS  UNA EVI, OCT  8 2008  5:22PM, HSINCHU, 8229592
951642366, SEMINARIO EN EL CLUB, OCT  8 2008  6:23PM, HSINCHU, 8229592
951931239, YAHOO ANALYTICS YA, OCT  8 2008 10:22PM, HSINCHU, 8229592
951992572, IF YOURLOVE  TRU, OCT  8 2008 11:22PM, HSINCHU, 8229592
952095519, OFF TO LUNCH FOR SOM, OCT  9 2008  1:05AM, HSINCHU, 9366872
952118934, , OCT  9 2008  1:29AM, HSINCHU, 16060889
952193596, W, OCT  9 2008  2:42AM, HSINCHU, 16060889
952337257, LOS  TOPICOS MAS UT, OCT  9 2008  5:22AM, HSINCHU, 8229592
952416118, BOO BOO EL PERRO MA, OCT  9 2008  7:23AM, HSINCHU, 8229592
952452809, MAC  WINDOWS CON ES, OCT  9 2008  8:22AM, HSINCHU, 8229592
952471460, EL NUEVO EJE ECONOMI, OCT  9 2008  8:52AM, HSINCHU, 8229592
952471910, EL NUEVO EJE ECONOMI, OCT  9 2008  8:52AM, HSINCHU, 8229592
952491320, ELLEN PAGE NOS TRAE, OCT  9 2008  9:23AM, HSINCHU, 8229592
952509676, ACTIVAMOS EL KARMA, OCT  9 2008  9:52AM, HSINCHU, 8229592
952569742, ITEREND NUEVO BUSCA, OCT  9 2008 11:22AM, HSINCHU, 8229592
952620249, NUNCA IRRITES A UN G, OCT  9 2008 12:23PM, HSINCHU, 8229592
952647889, AT CROFT INSTITUTE F, OCT  9 2008 12:52PM, HSINCHU, 9366872
952717798, UN TIPO SOLIDARIO M, OCT  9 2008  1:52PM, HSINCHU, 8229592
952842317, LA LISTA DEFINITIVA, OCT  9 2008  3:23PM, HSINCHU, 8229592
952966109, PERDIERON EL RESTO, OCT  9 2008  4:53PM, HSINCHU, 8229592
953004920, PORTUGAL IV ENCONTR, OCT  9 2008  5:23PM, HSINCHU, 8229592
953044471, A VISTA DE PAJARO M, OCT  9 2008  5:53PM, HSINCHU, 8229592
953081806, BAJA LA BOLSA SUBEN, OCT  9 2008  6:23PM, HSINCHU, 8229592
953156145, WORDPRESS GRANDIOSO, OCT  9 2008  7:22PM, HSINCHU, 8229592
953546364, DYING TOO MANY DRIN, OCT 10 2008  1:08AM, HSINCHU, 9366872
953649631, WWWW, OCT 10 2008  2:47AM, HSINCHU, 16060889
953748919, W, OCT 10 2008  4:32AM, HSINCHU, 16060889
953753945, B, OCT 10 2008  4:38AM, HSINCHU, 16060889
953761632, , OCT 10 2008  4:48AM, HSINCHU, 16060889
953788520, QUE CLASE DE CONTEN, OCT 10 2008  5:22AM, HSINCHU, 8229592
953803732, , OCT 10 2008  5:45AM, HSINCHU, 16060889
953829270, IN MARX WE TRUST IG, OCT 10 2008  6:22AM, HSINCHU, 8229592
953873941, RAZONES PARA VISI, OCT 10 2008  7:35AM, HSINCHU, 8229592
953885569, GESTION DE COMENTARI, OCT 10 2008  7:53AM, HSINCHU, 8229592
953904011, THEMES DE WORDPRES, OCT 10 2008  8:23AM, HSINCHU, 8229592
953904020, PINTORVA A SER QUE, OCT 10 2008  8:23AM, HSINCHU, 8229592
953941870, LOS  MEJORES JUEG, OCT 10 2008  9:23AM, HSINCHU, 8229592
953960838, GMAIL LABS INCORPORA, OCT 10 2008  9:53AM, HSINCHU, 8229592
953979116, GUANCHES EN EL CARIB, OCT 10 2008 10:23AM, HSINCHU, 8229592
953979140, EXPLICANDO LAS REDES, OCT 10 2008 10:23AM, HSINCHU, 8229592
954020048, EL PROYECTO GENOGRAP, OCT 10 2008 11:23AM, HSINCHU, 8229592
954020065, UNA COLECCION DE REL, OCT 10 2008 11:23AM, HSINCHU, 8229592
954042345, NOTICIAS SOBRE PIRAT, OCT 10 2008 11:53AM, HSINCHU, 8229592
954068604, MINICONCURSO, OCT 10 2008 12:23PM, HSINCHU, 8229592
954132791, ELADIO NO PAGARA A L, OCT 10 2008  1:23PM, HSINCHU, 8229592
954132806, GENIO Y FIGURA DE L, OCT 10 2008  1:23PM, HSINCHU, 8229592
954337937, LA CARRERA DEL GORIL, OCT 10 2008  3:53PM, HSINCHU, 8229592
954417902, NO AL CANON LA CA, OCT 10 2008  4:52PM, HSINCHU, 8229592
954456103, UN BESO DE HEIDI EN, OCT 10 2008  5:22PM, HSINCHU, 8229592
954533016, PROTAGONISTAS DE LA, OCT 10 2008  6:22PM, HSINCHU, 8229592
954751774, LA CRISIS FUTBOL DE, OCT 10 2008  9:23PM, HSINCHU, 8229592
954751792, FRASES DE ORO FUTBO, OCT 10 2008  9:23PM, HSINCHU, 8229592
954873508, ASI SE FORJA UNA CRI, OCT 10 2008 11:23PM, HSINCHU, 8229592
955064286, , OCT 11 2008  2:58AM, HSINCHU, 16060889
955251592, IS IN NEED OF AN IP, OCT 11 2008  7:48AM, HSINCHU, 16500570
955639772, SIENTA MAL LA COPA, OCT 11 2008  5:22PM, HSINCHU, 8229592
955639798, JOAO MOUTINHO PEQUE, OCT 11 2008  5:22PM, HSINCHU, 8229592
956172406, SUNDAY, OCT 12 2008  4:08AM, HSINCHU, 16060889
956180799, TUESDAY, OCT 12 2008  4:20AM, HSINCHU, 16060889
956198594, SATURDAY, OCT 12 2008  4:43AM, HSINCHU, 16060889
956210149, W, OCT 12 2008  5:00AM, HSINCHU, 16060889
956317603, MIS TARJETAS MOO BL, OCT 12 2008  8:22AM, HSINCHU, 8229592
956331496, GANANDO PERO SIN INT, OCT 12 2008  8:52AM, HSINCHU, 8229592
957082209, , OCT 13 2008  1:43AM, HSINCHU, 16060889
958454035, , OCT 14 2008  1:51AM, HSINCHU, 16060889
958573849, , OCT 14 2008  3:46AM, HSINCHU, 16060889
958657395, , OCT 14 2008  5:24AM, HSINCHU, 16060889
958660611, K, OCT 14 2008  5:29AM, HSINCHU, 16060889
958660779, ORZ, OCT 14 2008  5:29AM, HSINCHU, 16060889
958667967, , OCT 14 2008  5:39AM, HSINCHU, 16060889
958986714, IS THINKING UP WAYS, OCT 14 2008  1:03PM, HSINCHU, 16500570
961799445, , OCT 16 2008  3:06AM, HSINCHU, 16060889
961998275, HOORAY WORK DAY IS, OCT 16 2008  6:42AM, HSINCHU, 9366872
962208882, PREADOLESCENCIA O AL, OCT 16 2008 11:52AM, HSINCHU, 8229592
963260216, , OCT 17 2008  2:19AM, HSINCHU, 16060889
963598463, , OCT 17 2008  9:24AM, HSINCHU, 16060889
963617173, W, OCT 17 2008  9:54AM, HSINCHU, 16060889
966843830, , OCT 20 2008  1:31AM, HSINCHU, 16060889
966851203, , OCT 20 2008  1:38AM, HSINCHU, 16060889
967000449, BUYING NOV, OCT 20 2008  4:10AM, HSINCHU, 16861717
967143557, , OCT 20 2008  7:39AM, HSINCHU, 16060889
967143699, , OCT 20 2008  7:39AM, HSINCHU, 16060889
967975316, HAS GOT PLASNEWYDD F, OCT 20 2008  8:35PM, HSINCHU, 16500570
968196332, NOS ESPERA UN INVIER, OCT 20 2008 11:51PM, HSINCHU, 8229592
971504666, , OCT 23 2008  3:25AM, HSINCHU, 16060889
972945600, , OCT 24 2008  1:21AM, HSINCHU, 16060889
976142477, UPDATING MY SQUIDOO, OCT 26 2008 10:31PM, HSINCHU, 16980814
976208229, HI EVERYONE IN TWITT, OCT 26 2008 11:40PM, HSINCHU, 16980814
976208935, ILL BE POSTING WHEN, OCT 26 2008 11:41PM, HSINCHU, 16980814
976343636, ADDED PINK ROSE ITEM, OCT 27 2008  1:56AM, HSINCHU, 16980814
976768604, , OCT 27 2008  1:15AM, HSINCHU, 16060889
978387616, MADE A NEW GEEK SHIR, OCT 28 2008 10:44AM, HSINCHU, 16980814
978694907, TIME FOR A RUN AROUN, OCT 28 2008  9:10AM, HSINCHU, 9366872
978737522, MY RUN FROM BEFORE C, OCT 28 2008 10:12AM, HSINCHU, 9366872
978756763, HTTPTWITPICCOMI, OCT 28 2008 10:39AM, HSINCHU, 9366872
978762951, IF YOU HAVENT DONE, OCT 28 2008 10:48AM, HSINCHU, 9366872
978782528, HTTPTWITPICCOMI, OCT 28 2008 11:12AM, HSINCHU, 9366872
978802486, , OCT 28 2008 11:35AM, HSINCHU, 16060889
979592938, I ADDED DARK SHIRTS, OCT 29 2008  5:53AM, HSINCHU, 16980814
979597802, ALSO ADDED DUE IN A, OCT 29 2008  5:57AM, HSINCHU, 16980814
980224177, IS  FOR ONE LAST D, OCT 29 2008  8:24AM, HSINCHU, 16500570
980898020, SLOWLY BUT SURELY I, OCT 30 2008  2:05AM, HSINCHU, 16980814
981383988, CREATED A SQUIDOO LE, OCT 30 2008  8:10AM, HSINCHU, 16980814
981935028, HTTPTWITPICCOMI, OCT 30 2008 10:01AM, HSINCHU, 9366872
983162633, M M, OCT 31 2008  2:08AM, HSINCHU, 16060889
983510681, DRINKING A SMIRNOFF, OCT 31 2008  9:36AM, HSINCHU, 9366872
984498643, NUEVA ETAPA DE BLA B, OCT 31 2008 10:53PM, HSINCHU, 8229592
984892799, HTTPBITLYMVFL, NOV  1 2008  5:40AM, HSINCHU, 9366872
985055322, DINNER WITH BEN AND, NOV  1 2008 10:50AM, HSINCHU, 9366872
985231676, NUEVO PERIODISMO SIN, NOV  1 2008  2:53PM, HSINCHU, 8229592
985770612, LUNCH AND A WALK AT, NOV  2 2008 12:30AM, HSINCHU, 9366872
986064642, NOPE MY CLOCK WASNT, NOV  2 2008  6:19AM, HSINCHU, 16597579
986155141, NITE ALL TWINKLERS A, NOV  2 2008  9:06AM, HSINCHU, 16597579
986160852, HERE I AM HTTPTI, NOV  2 2008  9:18AM, HSINCHU, 16597579
986161044, HERE I AM HTTPTI, NOV  2 2008  9:19AM, HSINCHU, 16597579
986778226, RESTORING SNOW LEOPA, NOV  2 2008  9:42PM, HSINCHU, 9366872
986963923, SO IM GUESSING RUBY, NOV  3 2008 12:43AM, HSINCHU, 9366872
987015634, , NOV  3 2008  1:37AM, HSINCHU, 16060889
987041505, , NOV  3 2008  2:04AM, HSINCHU, 16060889
987050005, ON MY WAY TO WARNER, NOV  3 2008  2:13AM, HSINCHU, 16597579
987050488, AND LOVING THE PRIUS, NOV  3 2008  2:13AM, HSINCHU, 16597579
987144724, DRIVING BY YOURSELF, NOV  3 2008  3:50AM, HSINCHU, 16597579
987161283, ITS CALLED CRUISE C, NOV  3 2008  4:05AM, HSINCHU, 16597579
987185909, HTTPTWITPICCOMJ, NOV  3 2008  4:34AM, HSINCHU, 9366872
987209129, WOW NOT MANY TWINKLE, NOV  3 2008  5:03AM, HSINCHU, 16597579
987219359, PERFECT ROAD TRIP FO, NOV  3 2008  5:14AM, HSINCHU, 16597579
987229780, ICHIGEKI, NOV  3 2008  5:26AM, HSINCHU, 16060889
987241072, OR, NOV  3 2008  5:41AM, HSINCHU, 16060889
987266708, ABOUT  MILES FROM, NOV  3 2008  6:18AM, HSINCHU, 16597579
987388297, FINALLY IN MY HOTEL, NOV  3 2008  9:31AM, HSINCHU, 16597579
988457098, SITTING FOR A NICE M, NOV  3 2008 11:59PM, HSINCHU, 16597579
988598092, , NOV  4 2008  1:53AM, HSINCHU, 16060889
988708084, , NOV  4 2008  3:19AM, HSINCHU, 16060889
988995924, LAS ELECCIONES DE ES, NOV  4 2008  8:49AM, HSINCHU, 8229592
989087879, TAMPOCO LOS TORRENTS, NOV  4 2008 10:49AM, HSINCHU, 8229592
991526839, ITS APPARENTLY THE, NOV  5 2008  7:52PM, HSINCHU, 16821586
992307186, EL GABINETE DE INFOR, NOV  5 2008  9:14PM, HSINCHU, 8229592
992610840, READ ABOUT MY NEARD, NOV  6 2008  1:27AM, HSINCHU, 8055532
992744195, HE DIED I HAVEN, NOV  6 2008  3:17AM, HSINCHU, 16597579
993198726, CON LA VENTANA ABIER, NOV  6 2008 12:50PM, HSINCHU, 8229592
993977666, I WONDER IF A PENGUI, NOV  6 2008 10:03PM, HSINCHU, 8055532
996056959, MPG PRETTY GOO, NOV  8 2008  6:27AM, HSINCHU, 16597579
996355333, HERE I AM HTTPTI, NOV  8 2008  2:35PM, HSINCHU, 16597579
996455785, NICE DAY TO SIT ON T, NOV  8 2008  4:16PM, HSINCHU, 16597579
996489214, BLACK IS BEAUTIFUL U, NOV  8 2008  4:49PM, HSINCHU, 8229592
996527660, ANOTHER GREAT SPOT T, NOV  8 2008  5:28PM, HSINCHU, 16597579
996996627, HEY HAS CHRIS NORTON, NOV  9 2008  1:47AM, HSINCHU, 16597579
997876368, IS GOING TO THE SOCI, NOV  9 2008  9:11PM, HSINCHU, 16500570
998311816, SIGNED UP AWHILE BAC, NOV 10 2008  4:29AM, HSINCHU, 14726070
998799591, DID SHE REALLY SAY D, NOV 10 2008  2:21PM, HSINCHU, 8055532
998830703, SOE  WAYS OF MAK, NOV 10 2008  2:44PM, HSINCHU, 16500570
998982904, SOE P AND L SESSI, NOV 10 2008  4:26PM, HSINCHU, 16500570
999393042, I JUST LISTED  NEW, NOV 10 2008  9:19PM, HSINCHU, 14726070
999394441, I HAD THE BEST GRILL, NOV 10 2008  9:20PM, HSINCHU, 14726070
1000806385, WISHING I WAS HOME C, NOV 11 2008  6:35PM, HSINCHU, 14726070
1000806780, GETTING READY TO HEA, NOV 11 2008  6:35PM, HSINCHU, 14726070
1002116647, HAVING COFFEE GETTI, NOV 12 2008  2:31PM, HSINCHU, 14726070
1002263870, HAS UPDATED HER BLOG, NOV 12 2008  4:06PM, HSINCHU, 16500570
1002401871, I JUST LISTED THIS C, NOV 12 2008  5:32PM, HSINCHU, 14726070
1003428826, HEADING TO MELBOURN, NOV 13 2008  6:30AM, HSINCHU, 9366872
1003773948, EVERY MAN EXPRESSED, NOV 13 2008  1:25PM, HSINCHU, 8055532
1004088294, IS SLEEPY WORKING I, NOV 13 2008  4:52PM, HSINCHU, 16500570
1004114234, IM TESTING OUT JOTT, NOV 13 2008  5:07PM, HSINCHU, 8055532
1004176729, I SORT OF WISH I KNE, NOV 13 2008  5:47PM, HSINCHU, 8055532
1004679251, IVE SPENT THE PAST, NOV 14 2008 12:29AM, HSINCHU, 16597579
1004794419, RY, NOV 14 2008  2:01AM, HSINCHU, 16060889
